,problem,answer,wikipedia_link_1,wikipedia_link_2,wikipedia_link_3,wikipedia_link_4,wikipedia_link_5,wikipedia_link_6,wikipedia_link_7,wikipedia_link_8,wikipedia_link_9,wikipedia_link_10,wikipedia_link_11+,reasoning_types,wiki_links
415,"As of August 3rd, 2024, which Moose Jaw Warrior with a retired number was born on May 29, 1967?",Mike Keane,https://en.wikipedia.org/wiki/Moose_Jaw_Warriors,https://en.wikipedia.org/wiki/Mike_Keane,https://en.wikipedia.org/wiki/Theoren_Fleury,https://en.wikipedia.org/wiki/Kelly_Buchberger,https://en.wikipedia.org/wiki/Ryan_Smyth,,,,,,,Post processing | Temporal reasoning,"['https://en.wikipedia.org/wiki/Moose_Jaw_Warriors', 'https://en.wikipedia.org/wiki/Mike_Keane', 'https://en.wikipedia.org/wiki/Theoren_Fleury', 'https://en.wikipedia.org/wiki/Kelly_Buchberger', 'https://en.wikipedia.org/wiki/Ryan_Smyth']"
416,"As of July 2024, which protagonist of a 'shonen jump' series shares a name with a station on a West Japan Railway Company regional line?",Light Yagami,https://en.wikipedia.org/wiki/West_Japan_Railway_Company,https://en.wikipedia.org/wiki/Geibi_Line,https://en.wikipedia.org/wiki/Weekly_Sh%C5%8Dnen_Jump,https://en.wikipedia.org/wiki/Death_Note,,,,,,,,Tabular reasoning | Multiple constraints,"['https://en.wikipedia.org/wiki/West_Japan_Railway_Company', 'https://en.wikipedia.org/wiki/Geibi_Line', 'https://en.wikipedia.org/wiki/Weekly_Sh%C5%8Dnen_Jump', 'https://en.wikipedia.org/wiki/Death_Note']"
417,"What's the fifth song on the fifth album of the pop singer who was parodied in the fifth song on ""Weird Al"" Yankovic's fifth album?",Keep Walking,https://en.wikipedia.org/wiki/%22Weird_Al%22_Yankovic,https://en.wikipedia.org/wiki/Even_Worse,https://en.wikipedia.org/wiki/Tiffany_Darwish,https://en.wikipedia.org/wiki/The_Color_of_Silence,,,,,,,,Multiple constraints,"['https://en.wikipedia.org/wiki/%22Weird_Al%22_Yankovic', 'https://en.wikipedia.org/wiki/Even_Worse', 'https://en.wikipedia.org/wiki/Tiffany_Darwish', 'https://en.wikipedia.org/wiki/The_Color_of_Silence']"
418,I'm thinking of a painting. It was done by the same man who painted The Anti-Slavery Society Convention in the 1840's. The painting is about an election. Can you tell me the name of it?,Mock Election,https://en.wikipedia.org/wiki/World_Anti-Slavery_Convention,https://en.wikipedia.org/wiki/Benjamin_Haydon,,,,,,,,,,Multiple constraints,"['https://en.wikipedia.org/wiki/World_Anti-Slavery_Convention', 'https://en.wikipedia.org/wiki/Benjamin_Haydon']"
419,In what year was the former South Korean prime minister who is from the same clan as the oldest member of the band BTS born?,1948,https://en.wikipedia.org/wiki/BTS,https://en.wikipedia.org/wiki/Jin_(singer),https://en.wikipedia.org/wiki/Gwangsan_Kim_clan,,,,,,,,,Multiple constraints,"['https://en.wikipedia.org/wiki/BTS', 'https://en.wikipedia.org/wiki/Jin_(singer)', 'https://en.wikipedia.org/wiki/Gwangsan_Kim_clan']"
420,What is the birth year of the American President who once pet the cat who was buried at the Hagia Sofia in 2020?,1961,https://en.wikipedia.org/wiki/Hagia_Sophia,https://en.wikipedia.org/wiki/Gli,https://en.wikipedia.org/wiki/Barack_Obama,,,,,,,,,Multiple constraints,"['https://en.wikipedia.org/wiki/Hagia_Sophia', 'https://en.wikipedia.org/wiki/Gli', 'https://en.wikipedia.org/wiki/Barack_Obama']"
421,"There was a popular movie that came out in 2016 starring Emma Stone and Ryan Gosling, tell me where the director of this movie was born.","Providence, Rhode Island",https://en.wikipedia.org/wiki/La_La_Land,https://en.wikipedia.org/wiki/Damien_Chazelle,https://en.wikipedia.org/wiki/Ryan_Gosling,https://en.wikipedia.org/wiki/Emma_Stone,,,,,,,,Multiple constraints,"['https://en.wikipedia.org/wiki/La_La_Land', 'https://en.wikipedia.org/wiki/Damien_Chazelle', 'https://en.wikipedia.org/wiki/Ryan_Gosling', 'https://en.wikipedia.org/wiki/Emma_Stone']"
422,By what amount was the budget of Peter Jackson's King Kong higher than the budget of John Guillermin's version of King Kong?,$183 million,https://en.wikipedia.org/wiki/King_Kong_(franchise),https://en.wikipedia.org/wiki/King_Kong_(2005_film),https://en.wikipedia.org/wiki/King_Kong_(1976_film),,,,,,,,,Numerical reasoning | Multiple constraints,"['https://en.wikipedia.org/wiki/King_Kong_(franchise)', 'https://en.wikipedia.org/wiki/King_Kong_(2005_film)', 'https://en.wikipedia.org/wiki/King_Kong_(1976_film)']"
423,"What was the age difference at their deaths (in years) between Edgar Allan Poe and his rival, Rufus Wilmot Griswold, multiplied by 100?",200,https://en.wikipedia.org/wiki/Rufus_Wilmot_Griswold,https://en.wikipedia.org/wiki/Edgar_Allan_Poe,,,,,,,,,,Numerical reasoning | Post processing,"['https://en.wikipedia.org/wiki/Rufus_Wilmot_Griswold', 'https://en.wikipedia.org/wiki/Edgar_Allan_Poe']"
424,How old was the vice president to the fifth US president when he died?,50,https://en.wikipedia.org/wiki/List_of_presidents_of_the_United_States,https://en.wikipedia.org/wiki/Daniel_D._Tompkins,,,,,,,,,,Multiple constraints,"['https://en.wikipedia.org/wiki/List_of_presidents_of_the_United_States', 'https://en.wikipedia.org/wiki/Daniel_D._Tompkins']"
425,Who was the manager for the MLB World Series winning team the year that another team broke the record for the longest consecutive winning streak in a regular season? Base your answer on the following:  -- The team who broke the record did so in the 2010s,A. J. Hinch,https://en.wikipedia.org/wiki/List_of_Major_League_Baseball_longest_winning_streaks,https://en.wikipedia.org/wiki/2017_Cleveland_Indians_season,https://en.wikipedia.org/wiki/2017_World_Series,https://en.wikipedia.org/wiki/A._J._Hinch,,,,,,,,Tabular reasoning | Multiple constraints,"['https://en.wikipedia.org/wiki/List_of_Major_League_Baseball_longest_winning_streaks', 'https://en.wikipedia.org/wiki/2017_Cleveland_Indians_season', 'https://en.wikipedia.org/wiki/2017_World_Series', 'https://en.wikipedia.org/wiki/A._J._Hinch']"
426,What award was won in 2003 by the Swiss architecture firm that designed Roche Tower?,The Stirling Prize.,https://en.wikipedia.org/wiki/Roche_Tower,https://en.wikipedia.org/wiki/Herzog_%26_de_Meuron,,,,,,,,,,Temporal reasoning,"['https://en.wikipedia.org/wiki/Roche_Tower', 'https://en.wikipedia.org/wiki/Herzog_%26_de_Meuron']"
427,How many New Zealanders have won Australian Idol during seasons 1 to 8?,1,https://en.wikipedia.org/wiki/Australian_Idol,https://en.wikipedia.org/wiki/Guy_Sebastian,https://en.wikipedia.org/wiki/Casey_Donovan_(singer),https://en.wikipedia.org/wiki/Kate_DeAraugo,https://en.wikipedia.org/wiki/Damien_Leith,https://en.wikipedia.org/wiki/Natalie_Gauci,https://en.wikipedia.org/wiki/Wes_Carr,https://en.wikipedia.org/wiki/Stan_Walker,https://en.wikipedia.org/wiki/Royston_Sagigi-Baira,,,Numerical reasoning | Multiple constraints,"['https://en.wikipedia.org/wiki/Australian_Idol', 'https://en.wikipedia.org/wiki/Guy_Sebastian', 'https://en.wikipedia.org/wiki/Casey_Donovan_(singer)', 'https://en.wikipedia.org/wiki/Kate_DeAraugo', 'https://en.wikipedia.org/wiki/Damien_Leith', 'https://en.wikipedia.org/wiki/Natalie_Gauci', 'https://en.wikipedia.org/wiki/Wes_Carr', 'https://en.wikipedia.org/wiki/Stan_Walker', 'https://en.wikipedia.org/wiki/Royston_Sagigi-Baira']"
428,Who was the mayor of France's 25th President's hometown when they were first elected President?,Brigitte Fouré,https://en.wikipedia.org/wiki/List_of_presidents_of_France#Presidents_2,https://en.wikipedia.org/wiki/Emmanuel_Macron,https://en.wikipedia.org/wiki/Amiens,,,,,,,,,Multiple constraints,"['https://en.wikipedia.org/wiki/List_of_presidents_of_France#Presidents_2', 'https://en.wikipedia.org/wiki/Emmanuel_Macron', 'https://en.wikipedia.org/wiki/Amiens']"
429,"Of the Jason Statham movies that came out the year Dennis Hopper died, which could he have lived to see the premiere of?",13,https://en.wikipedia.org/wiki/Dennis_Hopper,https://en.wikipedia.org/wiki/Jason_Statham,https://en.wikipedia.org/wiki/13_(2010_film),https://en.wikipedia.org/wiki/The_Expendables_(2010_film),,,,,,,,Temporal reasoning,"['https://en.wikipedia.org/wiki/Dennis_Hopper', 'https://en.wikipedia.org/wiki/Jason_Statham', 'https://en.wikipedia.org/wiki/13_(2010_film)', 'https://en.wikipedia.org/wiki/The_Expendables_(2010_film)']"
430,Whose memoir was co-written with the author of Pill Head: The Secret Life of a Painkiller Addict and published post-humously 2 years after her death?,Edith Windsor,https://en.wikipedia.org/wiki/Edith_Windsor,https://en.wikipedia.org/wiki/Joshua_Lyon,,,,,,,,,,Multiple constraints,"['https://en.wikipedia.org/wiki/Edith_Windsor', 'https://en.wikipedia.org/wiki/Joshua_Lyon']"
431,"What day of the year do John of Lancaster (Duke of Bedford), Fritz Koenig (German Sculptor), Edith Windsor (LGBT Activist), and Ulf Merbold (German Physicist and Astronaut) all have in common? ",They are all born on June 20.,"https://en.wikipedia.org/wiki/John_of_Lancaster,_Duke_of_Bedford",https://en.wikipedia.org/wiki/Fritz_Koenig,https://en.wikipedia.org/wiki/Edith_Windsor,https://en.wikipedia.org/wiki/Ulf_Merbold,,,,,,,,Multiple constraints,"['https://en.wikipedia.org/wiki/John_of_Lancaster,_Duke_of_Bedford', 'https://en.wikipedia.org/wiki/Fritz_Koenig', 'https://en.wikipedia.org/wiki/Edith_Windsor', 'https://en.wikipedia.org/wiki/Ulf_Merbold']"
432,"In 2024's version of the world, which country was the birthplace of the Emperor who reigned from the year 363 to 364 over the Empire that the Goths played a major part in collapsing?",Serbia,https://en.wikipedia.org/wiki/Goths,https://en.wikipedia.org/wiki/Western_Roman_Empire,https://en.wikipedia.org/wiki/Jovian_(emperor),,,,,,,,,Multiple constraints,"['https://en.wikipedia.org/wiki/Goths', 'https://en.wikipedia.org/wiki/Western_Roman_Empire', 'https://en.wikipedia.org/wiki/Jovian_(emperor)']"
433,"Who was Prime Minister in Australia at the same time that Norman Gunston released ""Salute to ABBA""?",Malcolm Fraser,https://en.wikipedia.org/wiki/Norman_Gunston,https://en.wikipedia.org/wiki/List_of_prime_ministers_of_Australia#,,,,,,,,,,Tabular reasoning,"['https://en.wikipedia.org/wiki/Norman_Gunston', 'https://en.wikipedia.org/wiki/List_of_prime_ministers_of_Australia#']"
434,Which one was longer and by how much? James Cameron's film Titanic (1997) or the actual sinking of the Titanic in 1912?,"James Cameron's film Titanic was longer than the actual sinking Titanic, with a running time of 195 minutes, 35 minutes longer than the actual sinking of the Titanic in 1912.",https://en.wikipedia.org/wiki/Titanic,https://en.wikipedia.org/wiki/Titanic_(1997_film),,,,,,,,,,Numerical reasoning,"['https://en.wikipedia.org/wiki/Titanic', 'https://en.wikipedia.org/wiki/Titanic_(1997_film)']"
435,"I'm thinking of the  screenplay, co-wrote by the same author as Lonesome Dove, that won an Oscar for Best Adapted Screenplay 20 years after Lonesome Dove won the Pulitzer Prize. What was the name of the screenplay?",Brokeback Mountain,https://en.wikipedia.org/wiki/Lonesome_Dove ,https://en.wikipedia.org/wiki/78th_Academy_Awards,,,,,,,,,,Numerical reasoning | Temporal reasoning,"['https://en.wikipedia.org/wiki/Lonesome_Dove ', 'https://en.wikipedia.org/wiki/78th_Academy_Awards']"
436,What was the founding name of the company that ran the coal mining camp in the city where baseball great Willie Mays was born?,Sewanee Furnace Company,https://en.wikipedia.org/wiki/Willie_Mays,"https://en.wikipedia.org/wiki/Westfield,_Alabama","https://en.wikipedia.org/wiki/Tennessee_Coal,_Iron_and_Railroad_Company",,,,,,,,,Multiple constraints,"['https://en.wikipedia.org/wiki/Willie_Mays', 'https://en.wikipedia.org/wiki/Westfield,_Alabama', 'https://en.wikipedia.org/wiki/Tennessee_Coal,_Iron_and_Railroad_Company']"
437,"Which original Saturday Night Live cast member's daughter, tied with Hannah Waddingham for the Best Supporting Actress in a Streaming Series, Comedy award at the 1st Hollywood Critics Association TV Awards in 2021?",Laraine Newman,https://en.wikipedia.org/wiki/1st_Hollywood_Critics_Association_TV_Awards,https://en.wikipedia.org/wiki/Hannah_Einbinder,https://en.wikipedia.org/wiki/Hollywood_Creative_Alliance,,,,,,,,,Multiple constraints,"['https://en.wikipedia.org/wiki/1st_Hollywood_Critics_Association_TV_Awards', 'https://en.wikipedia.org/wiki/Hannah_Einbinder', 'https://en.wikipedia.org/wiki/Hollywood_Creative_Alliance']"
438,Who was the youngest climber to podium at the first year climbing was in the olympics?,Alberto Ginés López (18 at the time).,https://en.wikipedia.org/wiki/Sport_climbing_at_the_Summer_Olympics,https://en.wikipedia.org/wiki/Alberto_Gin%C3%A9s_L%C3%B3pez,https://en.wikipedia.org/wiki/Nathaniel_Coleman,https://en.wikipedia.org/wiki/Jakob_Schubert,https://en.wikipedia.org/wiki/Janja_Garnbret,https://en.wikipedia.org/wiki/Miho_Nonaka,https://en.wikipedia.org/wiki/Akiyo_Noguchi,,,,,Tabular reasoning,"['https://en.wikipedia.org/wiki/Sport_climbing_at_the_Summer_Olympics', 'https://en.wikipedia.org/wiki/Alberto_Gin%C3%A9s_L%C3%B3pez', 'https://en.wikipedia.org/wiki/Nathaniel_Coleman', 'https://en.wikipedia.org/wiki/Jakob_Schubert', 'https://en.wikipedia.org/wiki/Janja_Garnbret', 'https://en.wikipedia.org/wiki/Miho_Nonaka', 'https://en.wikipedia.org/wiki/Akiyo_Noguchi']"
439,"As of January 1st, 2024, how many buildings in New York City were 750ft or taller the last time Halley's Comet came close to Earth?",12,https://en.wikipedia.org/wiki/Halley%27s_Comet,https://en.wikipedia.org/wiki/List_of_tallest_buildings_in_New_York_City,,,,,,,,,,Tabular reasoning,"['https://en.wikipedia.org/wiki/Halley%27s_Comet', 'https://en.wikipedia.org/wiki/List_of_tallest_buildings_in_New_York_City']"
440,What novel by Ernest Hemingway won a Pulitzer prize for fiction that was subsequently overturned twelve years before the same author won again?,For Whom the Bell Tolls by Ernest Hemingway,https://en.wikipedia.org/wiki/Pulitzer_Prize_for_Fiction#Repeat_winners,https://en.wikipedia.org/wiki/For_Whom_the_Bell_Tolls#Pulitzer_Prize_snub,https://en.wikipedia.org/wiki/The_Old_Man_and_the_Sea#Reception_and_legacy,https://en.wikipedia.org/wiki/Ernest_Hemingway_bibliography,,,,,,,,Multiple constraints,"['https://en.wikipedia.org/wiki/Pulitzer_Prize_for_Fiction#Repeat_winners', 'https://en.wikipedia.org/wiki/For_Whom_the_Bell_Tolls#Pulitzer_Prize_snub', 'https://en.wikipedia.org/wiki/The_Old_Man_and_the_Sea#Reception_and_legacy', 'https://en.wikipedia.org/wiki/Ernest_Hemingway_bibliography']"
441,Who was the successor of the Egyptian Pharaoh that was in power when the Treasury of Atreus was completed?,Merneptah,https://en.wikipedia.org/wiki/Treasury_of_Atreus,https://en.wikipedia.org/wiki/Periodization_of_ancient_Egypt,https://en.wikipedia.org/wiki/Nineteenth_Dynasty_of_Egypt#Pharaohs_of_the_19th_Dynasty,https://en.wikipedia.org/wiki/Ramesses_II,https://en.wikipedia.org/wiki/Merneptah,,,,,,,Multiple constraints | Temporal reasoning,"['https://en.wikipedia.org/wiki/Treasury_of_Atreus', 'https://en.wikipedia.org/wiki/Periodization_of_ancient_Egypt', 'https://en.wikipedia.org/wiki/Nineteenth_Dynasty_of_Egypt#Pharaohs_of_the_19th_Dynasty', 'https://en.wikipedia.org/wiki/Ramesses_II', 'https://en.wikipedia.org/wiki/Merneptah']"
442,"What is the age difference between the youngest and oldest person, in the 20th Century, to win two Nobel Prizes?",20 years.,https://en.wikipedia.org/wiki/Nobel_Prize#Multiple_laureates,https://en.wikipedia.org/wiki/Marie_Curie,https://en.wikipedia.org/wiki/Linus_Pauling,https://en.wikipedia.org/wiki/John_Bardeen,https://en.wikipedia.org/wiki/Frederick_Sanger,,,,,,,Numerical reasoning | Temporal reasoning,"['https://en.wikipedia.org/wiki/Nobel_Prize#Multiple_laureates', 'https://en.wikipedia.org/wiki/Marie_Curie', 'https://en.wikipedia.org/wiki/Linus_Pauling', 'https://en.wikipedia.org/wiki/John_Bardeen', 'https://en.wikipedia.org/wiki/Frederick_Sanger']"
443,What season of The Challenge was airing when Bridgeton premiered?,"Season 36, Double Agents",https://en.wikipedia.org/wiki/The_Challenge_(TV_series),https://en.wikipedia.org/wiki/Bridgerton,,,,,,,,,,Multiple constraints,"['https://en.wikipedia.org/wiki/The_Challenge_(TV_series)', 'https://en.wikipedia.org/wiki/Bridgerton']"
444,"How many of Mark Calaway's consecutive Wrestlemania wins occurred in matches that were longer than the final match result in the same year's competition, not including years where Calaway was part of the final result?",Five,https://en.wikipedia.org/wiki/The_Undertaker,https://en.wikipedia.org/wiki/The_Streak_(professional_wrestling),https://en.wikipedia.org/wiki/WrestleMania_VII#Results,https://en.wikipedia.org/wiki/WrestleMania_VIII#Results,https://en.wikipedia.org/wiki/WrestleMania_IX#Results,https://en.wikipedia.org/wiki/WrestleMania_XI#Results,https://en.wikipedia.org/wiki/WrestleMania_XII#Results,https://en.wikipedia.org/wiki/WrestleMania_13#Results,https://en.wikipedia.org/wiki/WrestleMania_XIV#Results,https://en.wikipedia.org/wiki/WrestleMania_XV#Results,"https://en.wikipedia.org/wiki/WrestleMania_X-Seven#Results, https://en.wikipedia.org/wiki/WrestleMania_X8#Results, https://en.wikipedia.org/wiki/WrestleMania_XIX#Results, https://en.wikipedia.org/wiki/WrestleMania_XX#Results, https://en.wikipedia.org/wiki/WrestleMania_21#Results, https://en.wikipedia.org/wiki/WrestleMania_22#Results, https://en.wikipedia.org/wiki/WrestleMania_23#Results, https://en.wikipedia.org/wiki/WrestleMania_XXIV#Results, https://en.wikipedia.org/wiki/WrestleMania_25#Results, https://en.wikipedia.org/wiki/WrestleMania_XXVI#Results, https://en.wikipedia.org/wiki/WrestleMania_XXVII#Results, https://en.wikipedia.org/wiki/WrestleMania_XXVIII#Results, https://en.wikipedia.org/wiki/WrestleMania_29#Results",Numerical reasoning | Tabular reasoning | Multiple constraints,"['https://en.wikipedia.org/wiki/The_Undertaker', 'https://en.wikipedia.org/wiki/The_Streak_(professional_wrestling)', 'https://en.wikipedia.org/wiki/WrestleMania_VII#Results', 'https://en.wikipedia.org/wiki/WrestleMania_VIII#Results', 'https://en.wikipedia.org/wiki/WrestleMania_IX#Results', 'https://en.wikipedia.org/wiki/WrestleMania_XI#Results', 'https://en.wikipedia.org/wiki/WrestleMania_XII#Results', 'https://en.wikipedia.org/wiki/WrestleMania_13#Results', 'https://en.wikipedia.org/wiki/WrestleMania_XIV#Results', 'https://en.wikipedia.org/wiki/WrestleMania_XV#Results', 'https://en.wikipedia.org/wiki/WrestleMania_X-Seven#Results, https://en.wikipedia.org/wiki/WrestleMania_X8#Results, https://en.wikipedia.org/wiki/WrestleMania_XIX#Results, https://en.wikipedia.org/wiki/WrestleMania_XX#Results, https://en.wikipedia.org/wiki/WrestleMania_21#Results, https://en.wikipedia.org/wiki/WrestleMania_22#Results, https://en.wikipedia.org/wiki/WrestleMania_23#Results, https://en.wikipedia.org/wiki/WrestleMania_XXIV#Results, https://en.wikipedia.org/wiki/WrestleMania_25#Results, https://en.wikipedia.org/wiki/WrestleMania_XXVI#Results, https://en.wikipedia.org/wiki/WrestleMania_XXVII#Results, https://en.wikipedia.org/wiki/WrestleMania_XXVIII#Results, https://en.wikipedia.org/wiki/WrestleMania_29#Results']"
445,What number do you get when you add up the numbers in the postcode of the hospital John Lennon was born in?,14,https://en.wikipedia.org/wiki/John_Lennon,https://en.wikipedia.org/wiki/Liverpool_Maternity_Hospital,,,,,,,,,,Numerical reasoning,"['https://en.wikipedia.org/wiki/John_Lennon', 'https://en.wikipedia.org/wiki/Liverpool_Maternity_Hospital']"
446,Which set director born in 1936 won the Academy Award for Best Production Design during the 71st Academy Awards?,Jill Quertier,https://en.wikipedia.org/wiki/Academy_Award_for_Best_Production_Design,https://en.wikipedia.org/wiki/Martin_Childs,https://en.wikipedia.org/wiki/Jill_Quertier,,,,,,,,,Multiple constraints,"['https://en.wikipedia.org/wiki/Academy_Award_for_Best_Production_Design', 'https://en.wikipedia.org/wiki/Martin_Childs', 'https://en.wikipedia.org/wiki/Jill_Quertier']"
447,"The star of the TV show ""The Bear"" had his breakout role on a Showtime show. The actress who played his older sister on that Showtime show released an album in 2007. The label who released her album released their first album 27 years previous. From their first album, what number did the title track reach on the Billboard Hot 100?",Number 3,https://en.wikipedia.org/wiki/The_Bear_(TV_series),https://en.wikipedia.org/wiki/Jeremy_Allen_White,https://en.wikipedia.org/wiki/Shameless_(American_TV_series),https://en.wikipedia.org/wiki/Emmy_Rossum#Awards_and_nominations,https://en.wikipedia.org/wiki/Geffen_Records#History,https://en.wikipedia.org/wiki/The_Wanderer_(Donna_Summer_album),,,,,,Numerical reasoning | Tabular reasoning | Multiple constraints,"['https://en.wikipedia.org/wiki/The_Bear_(TV_series)', 'https://en.wikipedia.org/wiki/Jeremy_Allen_White', 'https://en.wikipedia.org/wiki/Shameless_(American_TV_series)', 'https://en.wikipedia.org/wiki/Emmy_Rossum#Awards_and_nominations', 'https://en.wikipedia.org/wiki/Geffen_Records#History', 'https://en.wikipedia.org/wiki/The_Wanderer_(Donna_Summer_album)']"
448,"When Taylor Swift first released her studio album ""1989,"" how many studio albums had Katy Perry already released?",4,https://en.wikipedia.org/wiki/Taylor_Swift_albums_discography,https://en.wikipedia.org/wiki/Katy_Perry_discography,,,,,,,,,,Multiple constraints,"['https://en.wikipedia.org/wiki/Taylor_Swift_albums_discography', 'https://en.wikipedia.org/wiki/Katy_Perry_discography']"
449,Who lived longer one of the Bronte sisters or Jane Austen?,Jane Austen,https://en.wikipedia.org/wiki/Bront%C3%AB_family,https://en.wikipedia.org/wiki/Jane_Austen,,,,,,,,,,Numerical reasoning,"['https://en.wikipedia.org/wiki/Bront%C3%AB_family', 'https://en.wikipedia.org/wiki/Jane_Austen']"
450,Who was the head coach of the team that won the Superbowl the year that the show Law & Order: SVU was released?,Mike Shanahan,https://en.wikipedia.org/wiki/Law_%26_Order:_Special_Victims_Unit,https://en.wikipedia.org/wiki/List_of_Super_Bowl_champions,https://en.wikipedia.org/wiki/1998_Denver_Broncos_season,,,,,,,,,Tabular reasoning | Multiple constraints,"['https://en.wikipedia.org/wiki/Law_%26_Order:_Special_Victims_Unit', 'https://en.wikipedia.org/wiki/List_of_Super_Bowl_champions', 'https://en.wikipedia.org/wiki/1998_Denver_Broncos_season']"
451,"How many times taller is the 7th highest mountain the world than Novake, Poljčane in Slovenia? Round your answer to one decimal place.",31.5,"https://en.wikipedia.org/wiki/Novake,_Polj%C4%8Dane",https://en.wikipedia.org/wiki/List_of_highest_mountains_on_Earth,,,,,,,,,,Numerical reasoning | Tabular reasoning | Multiple constraints,"['https://en.wikipedia.org/wiki/Novake,_Polj%C4%8Dane', 'https://en.wikipedia.org/wiki/List_of_highest_mountains_on_Earth']"
452,The Wisconsin Butter Fire led to dams being built to protect a lake that was the site of the plane crash death of which famous musician?,Otis Redding,https://en.wikipedia.org/wiki/Wisconsin_Butter_Fire,https://en.wikipedia.org/wiki/Lake_Monona,,,,,,,,,,Multiple constraints,"['https://en.wikipedia.org/wiki/Wisconsin_Butter_Fire', 'https://en.wikipedia.org/wiki/Lake_Monona']"
453,What is the English meaning of the name of the smaller of the two constellations which resides in the middle of the Summer Triangle?,Arrow.,https://en.wikipedia.org/wiki/Summer_Triangle,https://en.wikipedia.org/wiki/Sagitta,https://en.wikipedia.org/wiki/Vulpecula,,,,,,,,,Numerical reasoning | Tabular reasoning,"['https://en.wikipedia.org/wiki/Summer_Triangle', 'https://en.wikipedia.org/wiki/Sagitta', 'https://en.wikipedia.org/wiki/Vulpecula']"
454,"During the year that Serbia became an independent republic after separation from Montenegro, who won the Nobel Prize for Literature?",Orhan Pamuk,https://en.wikipedia.org/wiki/Socialist_Republic_of_Serbia,"https://en.wikipedia.org/wiki/2006_Nobel_Prize_in_Literature#:~:text=The%202006%20Nobel%20Prize%20in,clash%20and%20interlacing%20of%20cultures.%22",,,,,,,,,,Multiple constraints,"['https://en.wikipedia.org/wiki/Socialist_Republic_of_Serbia', 'https://en.wikipedia.org/wiki/2006_Nobel_Prize_in_Literature#:~:text=The%202006%20Nobel%20Prize%20in,clash%20and%20interlacing%20of%20cultures.%22']"
455,How many years older is the the library where Galileo's middle finger was first exhibited than the first public library to be lit using electric lightbulbs?,222,https://en.wikipedia.org/wiki/Galileo%27s_middle_finger#Exhibition_history,https://en.wikipedia.org/wiki/Laurentian_Library#Architecture,https://en.wikipedia.org/wiki/Literary_and_Philosophical_Society_of_Newcastle_upon_Tyne#,,,,,,,,,Numerical reasoning | Temporal reasoning,"['https://en.wikipedia.org/wiki/Galileo%27s_middle_finger#Exhibition_history', 'https://en.wikipedia.org/wiki/Laurentian_Library#Architecture', 'https://en.wikipedia.org/wiki/Literary_and_Philosophical_Society_of_Newcastle_upon_Tyne#']"
456,"If the person who played the joker in ""The Dark Knight"" (2008) had children, how old will they be on the films 50th anniversary?","Heath Ledger had one daughter named Matilda Ledger who was born on October 28, 2005. Since the film was released on the 18th of July in 2008, Matilda will be 52 on the films 50th anniversary.",https://en.wikipedia.org/wiki/Heath_Ledger,https://en.wikipedia.org/wiki/Michelle_Williams_(actress),https://en.wikipedia.org/wiki/The_Dark_Knight,,,,,,,,,Numerical reasoning | Post processing | Temporal reasoning,"['https://en.wikipedia.org/wiki/Heath_Ledger', 'https://en.wikipedia.org/wiki/Michelle_Williams_(actress)', 'https://en.wikipedia.org/wiki/The_Dark_Knight']"
