,problem,answer,wikipedia_link_1,wikipedia_link_2,wikipedia_link_3,wikipedia_link_4,wikipedia_link_5,wikipedia_link_6,wikipedia_link_7,wikipedia_link_8,wikipedia_link_9,wikipedia_link_10,wikipedia_link_11+,reasoning_types,wiki_links
594,What does Lose Your Way by the British rock band Love Amongst Ruin have in common with Sally Lunn Buns?,They're both made in Bath,https://en.wikipedia.org/wiki/Lose_Your_Way_(album),"https://en.wikipedia.org/wiki/Bath,_Somerset#Culture",https://en.wikipedia.org/wiki/Sally_Lunn_bun,,,,,,,,,Multiple constraints | Post processing,"['https://en.wikipedia.org/wiki/Lose_Your_Way_(album)', 'https://en.wikipedia.org/wiki/Bath,_Somerset#Culture', 'https://en.wikipedia.org/wiki/Sally_Lunn_bun']"
595,"In the same year that HMS Holland 1 was launched, a British monarch died. How long had their predecessor ruled for?","6 years, 11 months, 25 days.",https://en.wikipedia.org/wiki/HMS_Holland_1,https://en.wikipedia.org/wiki/1901,https://en.wikipedia.org/wiki/Queen_Victoria,https://en.wikipedia.org/wiki/William_IV,,,,,,,,Numerical reasoning,"['https://en.wikipedia.org/wiki/HMS_Holland_1', 'https://en.wikipedia.org/wiki/1901', 'https://en.wikipedia.org/wiki/Queen_Victoria', 'https://en.wikipedia.org/wiki/William_IV']"
596,What BTS member turned 5 years old the soonest after BoA's first album was released?,Jimin,https://en.wikipedia.org/wiki/BoA#Discography,https://en.wikipedia.org/wiki/ID;_Peace_B,https://en.wikipedia.org/wiki/BTS,https://en.wikipedia.org/wiki/Jimin,,,,,,,,Numerical reasoning | Multiple constraints,"['https://en.wikipedia.org/wiki/BoA#Discography', 'https://en.wikipedia.org/wiki/ID;_Peace_B', 'https://en.wikipedia.org/wiki/BTS', 'https://en.wikipedia.org/wiki/Jimin']"
597,"As of August 3rd 2024, what's the name of the university in the city right off exit 183 on I-94 in Michigan?",Eastern Michigan University,https://en.wikipedia.org/wiki/Interstate_94_in_Michigan#,"https://en.wikipedia.org/wiki/Ypsilanti,_Michigan",,,,,,,,,,Tabular reasoning,"['https://en.wikipedia.org/wiki/Interstate_94_in_Michigan#', 'https://en.wikipedia.org/wiki/Ypsilanti,_Michigan']"
598,"A certain singer won the Grammy Award for Song of the Year in 2008 and in the same year, sang at a prominent person's 90th Birthday Party concert in London. How many vowels are in the given first name of the person who the birthday party was for?",4,https://en.wikipedia.org/wiki/Grammy_Award_for_Song_of_the_Year#2000s,https://en.wikipedia.org/wiki/Amy_Winehouse,https://en.wikipedia.org/wiki/Nelson_Mandela,,,,,,,,,Numerical reasoning | Multiple constraints | Temporal reasoning,"['https://en.wikipedia.org/wiki/Grammy_Award_for_Song_of_the_Year#2000s', 'https://en.wikipedia.org/wiki/Amy_Winehouse', 'https://en.wikipedia.org/wiki/Nelson_Mandela']"
599,"Of Louis XVI, Louis XIV, and Louis XV, who was the youngest at their coronation? ",Louis XV,https://en.wikipedia.org/wiki/Louis_XIV,https://en.wikipedia.org/wiki/Louis_XV,https://en.wikipedia.org/wiki/Louis_XVI,,,,,,,,,Numerical reasoning,"['https://en.wikipedia.org/wiki/Louis_XIV', 'https://en.wikipedia.org/wiki/Louis_XV', 'https://en.wikipedia.org/wiki/Louis_XVI']"
600,"Who was the building named after on South Forest Avenue, which was built around 1959-1964 and designed by the architect married to Olga Lazovic?",Grady Gammage,https://en.wikipedia.org/wiki/Olgivanna_Lloyd_Wright,https://en.wikipedia.org/wiki/Frank_Lloyd_Wright,https://en.wikipedia.org/wiki/Gammage_Memorial_Auditorium,,,,,,,,,Multiple constraints,"['https://en.wikipedia.org/wiki/Olgivanna_Lloyd_Wright', 'https://en.wikipedia.org/wiki/Frank_Lloyd_Wright', 'https://en.wikipedia.org/wiki/Gammage_Memorial_Auditorium']"
601,Where did Marion Couthouy Smith publish her books and poems between 1906 and 1918? Which years did each of these magazine companies first start?,"Marion Couthouy Smith published her books and poems in Harper's Magazine, Century Magazine, Atlantic Monthly, and The New England Magazine. Harpers Magazine was first published in 1850. Century Magazine was published in 1881. The Atlantic was founded in 1857. Lastly, The New England Magazine was first published in 1884.",https://en.wikipedia.org/wiki/Marion_Couthouy_Smith,https://en.wikipedia.org/wiki/Harper%27s_Magazine,https://en.wikipedia.org/wiki/The_Century_Magazine,https://en.wikipedia.org/wiki/The_Atlantic,https://en.wikipedia.org/wiki/The_New_England_Magazine,,,,,,,Multiple constraints,"['https://en.wikipedia.org/wiki/Marion_Couthouy_Smith', 'https://en.wikipedia.org/wiki/Harper%27s_Magazine', 'https://en.wikipedia.org/wiki/The_Century_Magazine', 'https://en.wikipedia.org/wiki/The_Atlantic', 'https://en.wikipedia.org/wiki/The_New_England_Magazine']"
602,"What famous playable video game character is killed in their story for the purpose of creating a huge feeling of emptiness? To give a little help, this character also helps her family out by selling flowers she has grown, she knows and has traveled with a known eco-terrorist leader and also a owner of a bar in the slums.",Aerith Gainsborough.,https://en.wikipedia.org/wiki/Aerith_Gainsborough,https://en.wikipedia.org/wiki/Final_Fantasy_VII,https://en.wikipedia.org/wiki/Barret_Wallace,https://en.wikipedia.org/wiki/Tifa_Lockhart,,,,,,,,Multiple constraints,"['https://en.wikipedia.org/wiki/Aerith_Gainsborough', 'https://en.wikipedia.org/wiki/Final_Fantasy_VII', 'https://en.wikipedia.org/wiki/Barret_Wallace', 'https://en.wikipedia.org/wiki/Tifa_Lockhart']"
603,"What is the name of the popular vantage point that is featured in the 1980 comedy film ""The Gods Must Be Crazy"", and which provincial nature reserve is it located in as of 2024?",God's Window in Blyde River Canyon Nature Reserve,https://en.wikipedia.org/wiki/The_Gods_Must_Be_Crazy,https://en.wikipedia.org/wiki/Blyde_River_Canyon_Nature_Reserve#God.27s_Window,https://en.wikipedia.org/wiki/Blyde_River_Canyon_Nature_Reserve,,,,,,,,,Multiple constraints,"['https://en.wikipedia.org/wiki/The_Gods_Must_Be_Crazy', 'https://en.wikipedia.org/wiki/Blyde_River_Canyon_Nature_Reserve#God.27s_Window', 'https://en.wikipedia.org/wiki/Blyde_River_Canyon_Nature_Reserve']"
604,During which year did the actor who played George Falconer in the film A Single Man receive his first Academy Award? Include the name of the film for which he won.,Colin Firth won his first Academy Award in 2011 for The King's Speech.,https://en.wikipedia.org/wiki/A_Single_Man,https://en.wikipedia.org/wiki/Colin_Firth,https://en.wikipedia.org/wiki/List_of_awards_and_nominations_received_by_Colin_Firth,,,,,,,,,Multiple constraints,"['https://en.wikipedia.org/wiki/A_Single_Man', 'https://en.wikipedia.org/wiki/Colin_Firth', 'https://en.wikipedia.org/wiki/List_of_awards_and_nominations_received_by_Colin_Firth']"
605,"How many years before the founding of Google, was George Orwell's book ""1984"" published?",49 years.,https://en.wikipedia.org/wiki/Nineteen_Eighty-Four,https://en.wikipedia.org/wiki/Google,,,,,,,,,,Numerical reasoning | Tabular reasoning,"['https://en.wikipedia.org/wiki/Nineteen_Eighty-Four', 'https://en.wikipedia.org/wiki/Google']"
606,How many more knock-outs did Joe Louis have than Muhammad Ali?,15,https://en.wikipedia.org/wiki/Muhammad_Ali,https://en.wikipedia.org/wiki/Joe_Louis,,,,,,,,,,Numerical reasoning | Tabular reasoning,"['https://en.wikipedia.org/wiki/Muhammad_Ali', 'https://en.wikipedia.org/wiki/Joe_Louis']"
607,In the same city of California that is home to Walt Disney Imagineering is a famous retail shopping mall that opened with 1.6 million square feet of retail space. What is the name of that mall?,The Glendale Galleria.,https://en.wikipedia.org/wiki/Walt_Disney_Imagineering,https://en.wikipedia.org/wiki/Glendale_Galleria,,,,,,,,,,Multiple constraints,"['https://en.wikipedia.org/wiki/Walt_Disney_Imagineering', 'https://en.wikipedia.org/wiki/Glendale_Galleria']"
608,"The parish church of Renče, Slovenia, is dedicated to two saints. What would be the tropical zodiac sign of someone born on the date of their annual festival?",Cancer,https://en.wikipedia.org/wiki/Ren%C4%8De,https://en.wikipedia.org/wiki/Hermagoras_of_Aquileia,https://en.wikipedia.org/wiki/Zodiac,,,,,,,,,Tabular reasoning | Multiple constraints | Temporal reasoning,"['https://en.wikipedia.org/wiki/Ren%C4%8De', 'https://en.wikipedia.org/wiki/Hermagoras_of_Aquileia', 'https://en.wikipedia.org/wiki/Zodiac']"
609,What is the name of the river in the city where Ikea's headquarters are?,the Oude Rijn.,https://en.wikipedia.org/wiki/IKEA,https://en.wikipedia.org/wiki/Leiden,,,,,,,,,,Multiple constraints,"['https://en.wikipedia.org/wiki/IKEA', 'https://en.wikipedia.org/wiki/Leiden']"
610,How much did the film in which Jake Gyllenhaal played his second lead role gross in its initial run at the box office?,"Donnie Darko grossed $517,375 in its initial run at the box office.",https://en.wikipedia.org/wiki/Jake_Gyllenhaal,https://en.wikipedia.org/wiki/Donnie_Darko,,,,,,,,,,Multiple constraints,"['https://en.wikipedia.org/wiki/Jake_Gyllenhaal', 'https://en.wikipedia.org/wiki/Donnie_Darko']"
611,The actor who played Oliver Quick in Saltburn appeared in a music video for an artist who opened for Taylor Swift during the Latin American leg of the Eras Tour. What is the name of this music video?,Please Please Please,https://en.wikipedia.org/wiki/Saltburn_(film),https://en.wikipedia.org/wiki/The_Eras_Tour,https://en.wikipedia.org/wiki/Please_Please_Please_(Sabrina_Carpenter_song),,,,,,,,,Multiple constraints,"['https://en.wikipedia.org/wiki/Saltburn_(film)', 'https://en.wikipedia.org/wiki/The_Eras_Tour', 'https://en.wikipedia.org/wiki/Please_Please_Please_(Sabrina_Carpenter_song)']"
612,"In the region known as Sulawesi Selatan, which includes the Selayar Islands, what Austronesian language is predominantly spoken by the local population and how does the name ""Sulawesi Selatan"" relate to the location of the region?","The predominant Austronesian language spoken in Sulawesi Selatan, including the Selayar Islands, is Makassarese. The name ""Sulawesi Selatan"" refers to the southern part of Sulawesi.",https://en.wikipedia.org/wiki/Selatan,https://en.wikipedia.org/wiki/South_Sulawesi,https://en.wikipedia.org/wiki/Selayar_Islands,https://en.wikipedia.org/wiki/Makassarese_language,,,,,,,,Multiple constraints | Temporal reasoning,"['https://en.wikipedia.org/wiki/Selatan', 'https://en.wikipedia.org/wiki/South_Sulawesi', 'https://en.wikipedia.org/wiki/Selayar_Islands', 'https://en.wikipedia.org/wiki/Makassarese_language']"
613,"How many different Prime Ministers of the United Kingdom were there during the first term of Grover Cleveland's presidency, and who were they?","There were two different Prime Ministers of the United Kingdom during Grover Cleveland's first term as president, and they were William Ewart Gladstone and Robert Gascoyne-Cecil.",https://en.wikipedia.org/wiki/List_of_prime_ministers_of_the_United_Kingdom,"https://en.wikipedia.org/wiki/Grover_Cleveland#:~:text=Stephen%20Grover%20Cleveland%20(March%2018,serve%20non%2Dconsecutive%20presidential%20terms.",,,,,,,,,,Tabular reasoning | Multiple constraints | Temporal reasoning,"['https://en.wikipedia.org/wiki/List_of_prime_ministers_of_the_United_Kingdom', 'https://en.wikipedia.org/wiki/Grover_Cleveland#:~:text=Stephen%20Grover%20Cleveland%20(March%2018,serve%20non%2Dconsecutive%20presidential%20terms.']"
614,Which American high school can boast of an alumnus for whom the following is true: -Was inducted into the Pro Football Hall of Fame in 2018 -Played in 13 Pro Bowls -Played his first season of professional football for a team playing their first season in the NFL,"Kathleen Senior High School in Lakeland, Florida",https://en.wikipedia.org/wiki/List_of_Pro_Football_Hall_of_Fame_inductees,https://en.wikipedia.org/wiki/Pro_Bowl#Players_with_most_invitations,https://en.wikipedia.org/wiki/Baltimore_Ravens,https://en.wikipedia.org/wiki/Ray_Lewis,https://en.wikipedia.org/wiki/Kathleen_Senior_High_School,,,,,,,Tabular reasoning | Multiple constraints,"['https://en.wikipedia.org/wiki/List_of_Pro_Football_Hall_of_Fame_inductees', 'https://en.wikipedia.org/wiki/Pro_Bowl#Players_with_most_invitations', 'https://en.wikipedia.org/wiki/Baltimore_Ravens', 'https://en.wikipedia.org/wiki/Ray_Lewis', 'https://en.wikipedia.org/wiki/Kathleen_Senior_High_School']"
615,Which 1963 Disney film starred the same actress who played a dual role in a Disney film two years earlier about twins who plot to reunite their separated parents?,Summer Magic,https://en.wikipedia.org/wiki/List_of_Walt_Disney_Pictures_films,https://en.wikipedia.org/wiki/One_Hundred_and_One_Dalmatians,https://en.wikipedia.org/wiki/The_Absent-Minded_Professor,https://en.wikipedia.org/wiki/The_Parent_Trap_(1961_film),https://en.wikipedia.org/wiki/Nikki:_Wild_Dog_of_the_North,https://en.wikipedia.org/wiki/Greyfriars_Bobby_(film),https://en.wikipedia.org/wiki/Babes_in_Toyland_(1961_film),https://en.wikipedia.org/wiki/Son_of_Flubber,https://en.wikipedia.org/wiki/Miracle_of_the_White_Stallions,https://en.wikipedia.org/wiki/Savage_Sam_(film),"https://en.wikipedia.org/wiki/Summer_Magic_(film), https://en.wikipedia.org/wiki/The_Incredible_Journey_(film), https://en.wikipedia.org/wiki/The_Sword_in_the_Stone_(1963_film)",Numerical reasoning | Tabular reasoning | Multiple constraints | Temporal reasoning,"['https://en.wikipedia.org/wiki/List_of_Walt_Disney_Pictures_films', 'https://en.wikipedia.org/wiki/One_Hundred_and_One_Dalmatians', 'https://en.wikipedia.org/wiki/The_Absent-Minded_Professor', 'https://en.wikipedia.org/wiki/The_Parent_Trap_(1961_film)', 'https://en.wikipedia.org/wiki/Nikki:_Wild_Dog_of_the_North', 'https://en.wikipedia.org/wiki/Greyfriars_Bobby_(film)', 'https://en.wikipedia.org/wiki/Babes_in_Toyland_(1961_film)', 'https://en.wikipedia.org/wiki/Son_of_Flubber', 'https://en.wikipedia.org/wiki/Miracle_of_the_White_Stallions', 'https://en.wikipedia.org/wiki/Savage_Sam_(film)', 'https://en.wikipedia.org/wiki/Summer_Magic_(film), https://en.wikipedia.org/wiki/The_Incredible_Journey_(film), https://en.wikipedia.org/wiki/The_Sword_in_the_Stone_(1963_film)']"
616,"As of 2024, how many times could the country where shogi was invented fit inside the country where xiangqi was invented? Round to the nearest whole number.",25,https://en.wikipedia.org/wiki/Shogi,https://en.wikipedia.org/wiki/Xiangqi,https://en.wikipedia.org/wiki/China,https://en.wikipedia.org/wiki/Japan,,,,,,,,Numerical reasoning | Post processing,"['https://en.wikipedia.org/wiki/Shogi', 'https://en.wikipedia.org/wiki/Xiangqi', 'https://en.wikipedia.org/wiki/China', 'https://en.wikipedia.org/wiki/Japan']"
617,How many player entries were in the event that the winner of the 2008 Aussie Millions also won in 2010 at the PokerStars World Championship of Online Poker?,"1,240",https://en.wikipedia.org/wiki/Crown_Australian_Poker_Championship,https://en.wikipedia.org/wiki/Alexander_Kostritsyn,https://en.wikipedia.org/wiki/World_Championship_of_Online_Poker,,,,,,,,,Multiple constraints,"['https://en.wikipedia.org/wiki/Crown_Australian_Poker_Championship', 'https://en.wikipedia.org/wiki/Alexander_Kostritsyn', 'https://en.wikipedia.org/wiki/World_Championship_of_Online_Poker']"
618,How many votes did the opposition party get in the Brant riding the election before Justin Trudeau was elected Prime Minister?,"16,351",https://en.wikipedia.org/wiki/Justin_Trudeau,https://en.wikipedia.org/wiki/List_of_Canadian_federal_general_elections,https://en.wikipedia.org/wiki/Results_of_the_2011_Canadian_federal_election,,,,,,,,,Post processing | Temporal reasoning,"['https://en.wikipedia.org/wiki/Justin_Trudeau', 'https://en.wikipedia.org/wiki/List_of_Canadian_federal_general_elections', 'https://en.wikipedia.org/wiki/Results_of_the_2011_Canadian_federal_election']"
619,Who was the screenwriter of the first collaboration film between Sunrise and the studio who animates Full Metal Alchemist?,Keiko Nobumoto,https://en.wikipedia.org/wiki/Fullmetal_Alchemist,https://en.wikipedia.org/wiki/Bones_(studio),https://en.wikipedia.org/wiki/Cowboy_Bebop:_Knockin%27_on_Heaven%27s_Door,,,,,,,,,Tabular reasoning | Multiple constraints,"['https://en.wikipedia.org/wiki/Fullmetal_Alchemist', 'https://en.wikipedia.org/wiki/Bones_(studio)', 'https://en.wikipedia.org/wiki/Cowboy_Bebop:_Knockin%27_on_Heaven%27s_Door']"
620,"If Anastasia Romanov had still been alive when the 90s cartoon movie based on her was released, how old would she be?",Duchess Anastasia Romanov would have been 96 years old.,https://en.m.wikipedia.org/wiki/Grand_Duchess_Anastasia_Nikolaevna_of_Russia,https://en.m.wikipedia.org/wiki/Anastasia_(1997_film),,,,,,,,,,Numerical reasoning,"['https://en.m.wikipedia.org/wiki/Grand_Duchess_Anastasia_Nikolaevna_of_Russia', 'https://en.m.wikipedia.org/wiki/Anastasia_(1997_film)']"
621,Only one of the founding members of the superhero team 'The Defenders' was not a doctor. How many letters are in his name?,Five (the name is Namor'),https://en.wikipedia.org/wiki/List_of_Defenders_members,https://en.wikipedia.org/wiki/Doctor_Strange,https://en.wikipedia.org/wiki/Hulk,https://en.wikipedia.org/wiki/Namor,,,,,,,,Multiple constraints | Post processing,"['https://en.wikipedia.org/wiki/List_of_Defenders_members', 'https://en.wikipedia.org/wiki/Doctor_Strange', 'https://en.wikipedia.org/wiki/Hulk', 'https://en.wikipedia.org/wiki/Namor']"
622,"If Alice turned 36 on the day John F. Kennedy was assassinated, how old would she be on the day the Berlin Wall fell?",61,https://en.wikipedia.org/wiki/Assassination_of_John_F._Kennedy,"https://en.wikipedia.org/wiki/Fall_of_the_Berlin_Wall#:~:text=The%20fall%20of%20the%20Berlin,restrictions%20were%20overwhelmed%20and%20discarded.",,,,,,,,,,Numerical reasoning,"['https://en.wikipedia.org/wiki/Assassination_of_John_F._Kennedy', 'https://en.wikipedia.org/wiki/Fall_of_the_Berlin_Wall#:~:text=The%20fall%20of%20the%20Berlin,restrictions%20were%20overwhelmed%20and%20discarded.']"
623,"What career was shared by one of the world's oldest fathers, who had a child at the age of 96, and a man who killed his wife, named Nancy, and their son, named Daniel?",professional wrestler,https://en.wikipedia.org/wiki/List_of_oldest_fathers,https://en.wikipedia.org/wiki/Ramjit_Raghav,https://en.wikipedia.org/wiki/Chris_Benoit#Death,https://en.wikipedia.org/wiki/Professional_wrestling#Occupational_hazards,,,,,,,,Multiple constraints,"['https://en.wikipedia.org/wiki/List_of_oldest_fathers', 'https://en.wikipedia.org/wiki/Ramjit_Raghav', 'https://en.wikipedia.org/wiki/Chris_Benoit#Death', 'https://en.wikipedia.org/wiki/Professional_wrestling#Occupational_hazards']"
624,Which two rivers pass through the hometown of a famous Chinese philosopher who was born as Kong Qiu,"The Si River and the Yi River pass through Qufu, Confucius' home town.",https://en.wikipedia.org/wiki/Confucius#,https://en.wikipedia.org/wiki/Qufu#Geography,,,,,,,,,,Multiple constraints,"['https://en.wikipedia.org/wiki/Confucius#', 'https://en.wikipedia.org/wiki/Qufu#Geography']"
625,"How much larger was the concert capacity of the venue where Led Zeppelin recorded ""The Song Remains the Same"" than the venue where AC/DC recorded their first live album?","16,500",https://en.wikipedia.org/wiki/The_Song_Remains_the_Same_(album),https://en.wikipedia.org/wiki/Madison_Square_Garden,https://en.wikipedia.org/wiki/AC/DC_discography#Live_albums,https://en.wikipedia.org/wiki/If_You_Want_Blood_You%27ve_Got_It,"https://en.wikipedia.org/wiki/The_Apollo,_Glasgow",,,,,,,Numerical reasoning,"['https://en.wikipedia.org/wiki/The_Song_Remains_the_Same_(album)', 'https://en.wikipedia.org/wiki/Madison_Square_Garden', 'https://en.wikipedia.org/wiki/AC/DC_discography#Live_albums', 'https://en.wikipedia.org/wiki/If_You_Want_Blood_You%27ve_Got_It', 'https://en.wikipedia.org/wiki/The_Apollo,_Glasgow']"
626,Five Nights at Freddy's initial game release came one day short of the 19 year anniversary of the death of which Grateful Dead band member?,Jerry Garcia,https://en.wikipedia.org/wiki/Five_Nights_at_Freddy%27s,https://en.wikipedia.org/wiki/Grateful_Dead#Main_career_(1967–1995),,,,,,,,,,Numerical reasoning | Tabular reasoning | Multiple constraints | Post processing | Temporal reasoning,"['https://en.wikipedia.org/wiki/Five_Nights_at_Freddy%27s', 'https://en.wikipedia.org/wiki/Grateful_Dead#Main_career_(1967–1995)']"
627,One episode title from classic Doctor Who series 12 features the name of a Pentateuch book. Can you tell me which part of this episode had the lowest viewing figures in roman numerals?,"III (the answer is Genesis of the Daleks, the 3rd part had the least amount of viewers when broadcast)",https://en.wikipedia.org/wiki/Old_Testament,https://en.wikipedia.org/wiki/Doctor_Who_season_12,https://en.wikipedia.org/wiki/Genesis_of_the_Daleks,,,,,,,,,Tabular reasoning | Multiple constraints | Post processing,"['https://en.wikipedia.org/wiki/Old_Testament', 'https://en.wikipedia.org/wiki/Doctor_Who_season_12', 'https://en.wikipedia.org/wiki/Genesis_of_the_Daleks']"
628,"Which Naruto characters from before the TV series ""Boruto: Naruto the next generation"", can perfectly use the Rasengan technique?","Naruto Uzumaki, Minato Namikaze and Jiraiya.",https://en.wikipedia.org/wiki/Naruto_Shippuden_the_Movie:_The_Lost_Tower,https://en.wikipedia.org/wiki/Naruto_Uzumaki,https://en.wikipedia.org/wiki/Jiraiya_(Naruto),,,,,,,,,Multiple constraints,"['https://en.wikipedia.org/wiki/Naruto_Shippuden_the_Movie:_The_Lost_Tower', 'https://en.wikipedia.org/wiki/Naruto_Uzumaki', 'https://en.wikipedia.org/wiki/Jiraiya_(Naruto)']"
629,"Twin brothers and former linebackers Ricardo and Devon McDonald were drafted into the NFL in 1992 and 1993, respectively. How many more games did one twin play than the other during their NFL career?",56,https://en.wikipedia.org/wiki/Devon_McDonald,https://en.wikipedia.org/wiki/Ricardo_McDonald,,,,,,,,,,Numerical reasoning,"['https://en.wikipedia.org/wiki/Devon_McDonald', 'https://en.wikipedia.org/wiki/Ricardo_McDonald']"
630,"How old was the United States Air Force when the 317th Fighter-Interceptor Squadron was inactivated, rounded to the nearest year?",22 years old,https://en.wikipedia.org/wiki/317th_Fighter-Interceptor_Squadron,https://en.wikipedia.org/wiki/United_States_Air_Force,,,,,,,,,,Numerical reasoning | Temporal reasoning,"['https://en.wikipedia.org/wiki/317th_Fighter-Interceptor_Squadron', 'https://en.wikipedia.org/wiki/United_States_Air_Force']"
631,Who was the Argentinian president who resigned from the position the same year the José Martín Olaeta Stadium was inaugurated?,Pedro Ramírez,https://en.wikipedia.org/wiki/Estadio_Jos%C3%A9_Mart%C3%ADn_Olaeta,https://en.wikipedia.org/wiki/1944_in_Argentina,,,,,,,,,,Multiple constraints,"['https://en.wikipedia.org/wiki/Estadio_Jos%C3%A9_Mart%C3%ADn_Olaeta', 'https://en.wikipedia.org/wiki/1944_in_Argentina']"
632,"How many days is it from Damon Wayans's first episode as a cast member of Saturday Night Live to Damon Wayans's first episode as a cast member of In Living Color, including the days the first episodes premiered?",1619 days.,https://en.wikipedia.org/wiki/Damon_Wayans,https://en.wikipedia.org/wiki/Saturday_Night_Live_season_11,https://en.wikipedia.org/wiki/In_Living_Color,https://en.wikipedia.org/wiki/List_of_In_Living_Color_episodes,,,,,,,,Numerical reasoning | Multiple constraints,"['https://en.wikipedia.org/wiki/Damon_Wayans', 'https://en.wikipedia.org/wiki/Saturday_Night_Live_season_11', 'https://en.wikipedia.org/wiki/In_Living_Color', 'https://en.wikipedia.org/wiki/List_of_In_Living_Color_episodes']"
633,"There is a famous Texas city where a Stadium built in 1930 hosted six games for the 1994 World Cup, but only after widening the field and permanently installing natural grass on the playing surface. What was the average (mean) number of attendance for these six games?","58,692",https://en.wikipedia.org/wiki/1994_FIFA_World_Cup,https://en.wikipedia.org/wiki/Cotton_Bowl_(stadium),https://en.wikipedia.org/wiki/Dallas,,,,,,,,,Numerical reasoning | Multiple constraints | Post processing,"['https://en.wikipedia.org/wiki/1994_FIFA_World_Cup', 'https://en.wikipedia.org/wiki/Cotton_Bowl_(stadium)', 'https://en.wikipedia.org/wiki/Dallas']"
634,The September Declaration has a rough equivalent in the Netherlands that takes place on the same day every year. In what century was the current name of this day (as of August 2024) chosen?,the 19th century,https://en.wikipedia.org/wiki/September_Declaration,https://en.wikipedia.org/wiki/Speech_from_the_throne#Netherlands,https://en.wikipedia.org/wiki/Prinsjesdag#History,,,,,,,,,Multiple constraints,"['https://en.wikipedia.org/wiki/September_Declaration', 'https://en.wikipedia.org/wiki/Speech_from_the_throne#Netherlands', 'https://en.wikipedia.org/wiki/Prinsjesdag#History']"
635,Who was team captain of the team that won the Stanley Cup the year Connor McDavid was born?,Steve Yzerman,https://en.wikipedia.org/wiki/Connor_McDavid,https://en.wikipedia.org/wiki/List_of_Stanley_Cup_champions,https://en.wikipedia.org/wiki/1996%E2%80%9397_Detroit_Red_Wings_season,,,,,,,,,Temporal reasoning,"['https://en.wikipedia.org/wiki/Connor_McDavid', 'https://en.wikipedia.org/wiki/List_of_Stanley_Cup_champions', 'https://en.wikipedia.org/wiki/1996%E2%80%9397_Detroit_Red_Wings_season']"
636,"From the date the Soviet Union first used their veto power in the UN security council, how many more years would the then-Soviet leader live?",Seven,https://en.wikipedia.org/wiki/List_of_vetoed_United_Nations_Security_Council_resolutions#Resolutions,https://en.wikipedia.org/wiki/List_of_leaders_of_the_Soviet_Union,https://en.wikipedia.org/wiki/Joseph_Stalin,,,,,,,,,Numerical reasoning,"['https://en.wikipedia.org/wiki/List_of_vetoed_United_Nations_Security_Council_resolutions#Resolutions', 'https://en.wikipedia.org/wiki/List_of_leaders_of_the_Soviet_Union', 'https://en.wikipedia.org/wiki/Joseph_Stalin']"
