,problem,answer,wikipedia_link_1,wikipedia_link_2,wikipedia_link_3,wikipedia_link_4,wikipedia_link_5,wikipedia_link_6,wikipedia_link_7,wikipedia_link_8,wikipedia_link_9,wikipedia_link_10,wikipedia_link_11+,reasoning_types,wiki_links
211,How many times could Usain Bolt span the length of a standard Olympic-sized swimming pool if Tom Daley was standing on his head? Please answer to a whole Usain or Tom without exceeding the length of the pool.,13,https://en.wikipedia.org/wiki/Olympic-size_swimming_pool,https://en.wikipedia.org/wiki/Usain_Bolt,https://en.wikipedia.org/wiki/Tom_Daley,,,,,,,,,Numerical reasoning | Post processing,"['https://en.wikipedia.org/wiki/Olympic-size_swimming_pool', 'https://en.wikipedia.org/wiki/Usain_Bolt', 'https://en.wikipedia.org/wiki/Tom_Daley']"
212,Who was Prime Minister when Will Young won Pop Idol?,Tony Blair,https://en.wikipedia.org/wiki/Pop_Idol,https://en.wikipedia.org/wiki/Timeline_of_prime_ministers_of_Great_Britain_and_the_United_Kingdom,,,,,,,,,,Multiple constraints | Post processing | Temporal reasoning,"['https://en.wikipedia.org/wiki/Pop_Idol', 'https://en.wikipedia.org/wiki/Timeline_of_prime_ministers_of_Great_Britain_and_the_United_Kingdom']"
213,"I'm thinking of a diving duck, the largest found in North America, that breeds in the Prairie Pothole Region. This duck, smothered in blackcurrant sauce, was once described by Edith Wharton as an ""especially luxurious dinner"" which was served in New York City in the 1870s. Which duck am I thinking of?",The canvasback.,https://en.wikipedia.org/wiki/Diving_duck,https://en.wikipedia.org/wiki/Prairie_Pothole_Region,https://en.wikipedia.org/wiki/Canvasback,,,,,,,,,Multiple constraints,"['https://en.wikipedia.org/wiki/Diving_duck', 'https://en.wikipedia.org/wiki/Prairie_Pothole_Region', 'https://en.wikipedia.org/wiki/Canvasback']"
214,"I'm thinking of an Actor that won an Oscar for Best Supporting Actor two years after being nominated for the same award, but not winning.  The same year that the actor won the Oscar, the Actor also won a BAFTA in the same category and for the same film.  The Actor also won a Tony award in 1974.",Christopher Plummer,https://en.wikipedia.org/wiki/28th_Tony_Awards,https://en.wikipedia.org/wiki/Academy_Award_for_Best_Supporting_Actor,https://en.wikipedia.org/wiki/BAFTA_Award_for_Best_Actor_in_a_Supporting_Role,https://en.wikipedia.org/wiki/List_of_awards_and_nominations_received_by_Christopher_Plummer,,,,,,,,Tabular reasoning | Multiple constraints | Post processing | Temporal reasoning,"['https://en.wikipedia.org/wiki/28th_Tony_Awards', 'https://en.wikipedia.org/wiki/Academy_Award_for_Best_Supporting_Actor', 'https://en.wikipedia.org/wiki/BAFTA_Award_for_Best_Actor_in_a_Supporting_Role', 'https://en.wikipedia.org/wiki/List_of_awards_and_nominations_received_by_Christopher_Plummer']"
215,"In the George Eliot novel described by Virginia Woolf as ""one of the few English novels written for grown-up people"", one of the main characters shares a first name with a former prime minister of Burkino Faso who went on the join the board of a Canadian mining company. What forename do they share?",Tertius,https://en.wikipedia.org/wiki/George_Eliot,https://en.wikipedia.org/wiki/Middlemarch,https://en.wikipedia.org/wiki/Tertius_Zongo,,,,,,,,,Multiple constraints,"['https://en.wikipedia.org/wiki/George_Eliot', 'https://en.wikipedia.org/wiki/Middlemarch', 'https://en.wikipedia.org/wiki/Tertius_Zongo']"
216,What is the population of the town (as of December 2020) that holds the Mountain Cheese Olympics?,5793,https://en.wikipedia.org/wiki/Mountain_Cheese_Olympics,https://en.wikipedia.org/wiki/Appenzell_District,,,,,,,,,,Numerical reasoning | Multiple constraints,"['https://en.wikipedia.org/wiki/Mountain_Cheese_Olympics', 'https://en.wikipedia.org/wiki/Appenzell_District']"
217,How old would James Logan have been when the estate of his descendent donated Neshaminy State Park land to the Commonwealth of Pennsylvania?,282 years,https://en.wikipedia.org/wiki/Neshaminy_State_Park,https://en.wikipedia.org/wiki/James_Logan_(statesman),,,,,,,,,,Numerical reasoning,"['https://en.wikipedia.org/wiki/Neshaminy_State_Park', 'https://en.wikipedia.org/wiki/James_Logan_(statesman)']"
218,Is the time between Oasis's first album and 2024 shorter or longer than between Oasis's first album and The Beatles' last album?,Longer.,https://en.wikipedia.org/wiki/Oasis_(band),https://en.wikipedia.org/wiki/The_Beatles,,,,,,,,,,Numerical reasoning,"['https://en.wikipedia.org/wiki/Oasis_(band)', 'https://en.wikipedia.org/wiki/The_Beatles']"
219,Ysaires Restituyo was a volleyball player known for playing in the NORCECA Beach Volleyball Circuit. How much older was her partner in 2007 than her partner in 2009?,2 years,https://en.wikipedia.org/wiki/Ysaires_Restituyo,https://en.wikipedia.org/wiki/Cinthia_Pi%C3%B1eiro#,https://en.wikipedia.org/wiki/Ana_Ligia_Fabian,,,,,,,,,Numerical reasoning,"['https://en.wikipedia.org/wiki/Ysaires_Restituyo', 'https://en.wikipedia.org/wiki/Cinthia_Pi%C3%B1eiro#', 'https://en.wikipedia.org/wiki/Ana_Ligia_Fabian']"
220,"Demi Moore shares a birthday with which costar from the movies ""Margin Call"" and ""Deconstructing Harry""?",Stanley Tucci,https://en.wikipedia.org/wiki/Deconstructing_Harry,https://en.wikipedia.org/wiki/Margin_Call,https://en.wikipedia.org/wiki/Stanley_Tucci,https://en.wikipedia.org/wiki/Demi_Moore,,,,,,,,Multiple constraints,"['https://en.wikipedia.org/wiki/Deconstructing_Harry', 'https://en.wikipedia.org/wiki/Margin_Call', 'https://en.wikipedia.org/wiki/Stanley_Tucci', 'https://en.wikipedia.org/wiki/Demi_Moore']"
221,If the Great North Run took place on York's Medieval Walls how many circuits of them would the athletes run? Round to the nearest tenth of a circuit.,6.2 circuits.,https://en.wikipedia.org/wiki/York_city_walls,https://en.wikipedia.org/wiki/Great_North_Run,https://en.wikipedia.org/wiki/Half_marathon,,,,,,,,,Numerical reasoning,"['https://en.wikipedia.org/wiki/York_city_walls', 'https://en.wikipedia.org/wiki/Great_North_Run', 'https://en.wikipedia.org/wiki/Half_marathon']"
222,What was the 2021 population of the birthplace of the leader of the party that won the 1869 Newfoundland general election?,"9,162 was the population of Shaftesbury (the birthplace of Charles Fox Bennett) in the 2021 census.",https://en.wikipedia.org/wiki/1869_Newfoundland_general_election,https://en.wikipedia.org/wiki/Charles_Fox_Bennett,https://en.wikipedia.org/wiki/Shaftesbury,,,,,,,,,Tabular reasoning | Multiple constraints,"['https://en.wikipedia.org/wiki/1869_Newfoundland_general_election', 'https://en.wikipedia.org/wiki/Charles_Fox_Bennett', 'https://en.wikipedia.org/wiki/Shaftesbury']"
223,"After Meat Loaf legally changed his name due to a commercial, what was the first new brand launched by the company to whom the commercial belonged?",Dockers,https://en.wikipedia.org/wiki/Meat_Loaf#Personal_life,https://en.wikipedia.org/wiki/Levi_Strauss_%26_Co.#Blue_jeans_era_(1960s%E2%80%931980s),,,,,,,,,,Temporal reasoning,"['https://en.wikipedia.org/wiki/Meat_Loaf#Personal_life', 'https://en.wikipedia.org/wiki/Levi_Strauss_%26_Co.#Blue_jeans_era_(1960s%E2%80%931980s)']"
224,"I'm a concert venue in Washington, D.C. Blink-182 played here on their tour the same year Brazil won their fifth FIFA World Cup. What was my name in 2010?",Verizon Center,https://en.wikipedia.org/wiki/Brazil_national_football_team#FIFA_World_Cup,https://en.wikipedia.org/wiki/Blink-182#Tours,https://en.wikipedia.org/wiki/Pop_Disaster_Tour,https://en.wikipedia.org/wiki/Capital_One_Arena,,,,,,,,Tabular reasoning | Temporal reasoning,"['https://en.wikipedia.org/wiki/Brazil_national_football_team#FIFA_World_Cup', 'https://en.wikipedia.org/wiki/Blink-182#Tours', 'https://en.wikipedia.org/wiki/Pop_Disaster_Tour', 'https://en.wikipedia.org/wiki/Capital_One_Arena']"
225,Which prime minister has been in office between 2017 and 2022 and also shares their middle name with a former monarch of Scotland.,Theresa (Mary) May,https://en.wikipedia.org/wiki/List_of_prime_ministers_of_the_United_Kingdom,https://en.wikipedia.org/wiki/Theresa_May,https://en.wikipedia.org/wiki/Boris_Johnson,https://en.wikipedia.org/wiki/Liz_Truss,https://en.wikipedia.org/wiki/Rishi_Sunak,https://en.wikipedia.org/wiki/List_of_Scottish_monarchs,,,,,,Multiple constraints | Temporal reasoning,"['https://en.wikipedia.org/wiki/List_of_prime_ministers_of_the_United_Kingdom', 'https://en.wikipedia.org/wiki/Theresa_May', 'https://en.wikipedia.org/wiki/Boris_Johnson', 'https://en.wikipedia.org/wiki/Liz_Truss', 'https://en.wikipedia.org/wiki/Rishi_Sunak', 'https://en.wikipedia.org/wiki/List_of_Scottish_monarchs']"
226,"Who were the first two women who won the Nobel Prize, in any category, who were also mothers?",Marie Curie and Grazia Deledda,https://en.wikipedia.org/wiki/Marie_Curie,en.wikipedia.org/wiki/Grazia_Deledda,en.wikipedia.org/wiki/List_of_female_Nobel_laureates,https://en.wikipedia.org/wiki/Irène_Joliot-Curie,,,,,,,,Numerical reasoning | Multiple constraints,"['https://en.wikipedia.org/wiki/Marie_Curie', 'en.wikipedia.org/wiki/Grazia_Deledda', 'en.wikipedia.org/wiki/List_of_female_Nobel_laureates', 'https://en.wikipedia.org/wiki/Irène_Joliot-Curie']"
227,"Of the non-Americans who have won the Phoenix Open as of 2024, who was the youngest at the time of his win?",Hideki Matsuyama,https://en.wikipedia.org/wiki/Phoenix_Open,https://en.wikipedia.org/wiki/Nick_Taylor_(golfer),https://en.wikipedia.org/wiki/Hideki_Matsuyama,https://en.wikipedia.org/wiki/Aaron_Baddeley,https://en.wikipedia.org/wiki/Vijay_Singh,https://en.wikipedia.org/wiki/Jesper_Parnevik,https://en.wikipedia.org/wiki/Sandy_Lyle,https://en.wikipedia.org/wiki/Bruce_Crampton,https://en.wikipedia.org/wiki/George_Knudson,https://en.wikipedia.org/wiki/Bobby_Locke,,Numerical reasoning | Temporal reasoning,"['https://en.wikipedia.org/wiki/Phoenix_Open', 'https://en.wikipedia.org/wiki/Nick_Taylor_(golfer)', 'https://en.wikipedia.org/wiki/Hideki_Matsuyama', 'https://en.wikipedia.org/wiki/Aaron_Baddeley', 'https://en.wikipedia.org/wiki/Vijay_Singh', 'https://en.wikipedia.org/wiki/Jesper_Parnevik', 'https://en.wikipedia.org/wiki/Sandy_Lyle', 'https://en.wikipedia.org/wiki/Bruce_Crampton', 'https://en.wikipedia.org/wiki/George_Knudson', 'https://en.wikipedia.org/wiki/Bobby_Locke']"
228,"The US Naval ship that sunk in Havana Harbor on February 15, 1898, is named for a state that was admitted to the Union while what woman was serving as First Lady?",Elizabeth Monroe,https://en.wikipedia.org/wiki/USS_Maine_(1889),https://en.wikipedia.org/wiki/Maine,https://en.wikipedia.org/wiki/List_of_first_ladies_of_the_United_States,,,,,,,,,Multiple constraints | Temporal reasoning,"['https://en.wikipedia.org/wiki/USS_Maine_(1889)', 'https://en.wikipedia.org/wiki/Maine', 'https://en.wikipedia.org/wiki/List_of_first_ladies_of_the_United_States']"
229,"As of the 2023 Major League Baseball season, who is the only player in the top 15 lists of career home runs, career runs batted in, and career hits, who was also named (in 2007) the all-time Gold Glove team?",Willie Mays,https://en.wikipedia.org/wiki/List_of_Major_League_Baseball_career_home_run_leaders,https://en.wikipedia.org/wiki/List_of_Major_League_Baseball_career_runs_batted_in_leaders,https://en.wikipedia.org/wiki/List_of_Major_League_Baseball_career_hits_leaders,https://en.wikipedia.org/wiki/Gold_Glove_Award,,,,,,,,Tabular reasoning | Multiple constraints,"['https://en.wikipedia.org/wiki/List_of_Major_League_Baseball_career_home_run_leaders', 'https://en.wikipedia.org/wiki/List_of_Major_League_Baseball_career_runs_batted_in_leaders', 'https://en.wikipedia.org/wiki/List_of_Major_League_Baseball_career_hits_leaders', 'https://en.wikipedia.org/wiki/Gold_Glove_Award']"
230,Who had the best career batting average out of every player to hit a home run in the 2002 World Series matchup between the Anaheim Angeles and San Francisco Giants?,Barry Bonds with a .298 lifetime batting average.,https://en.wikipedia.org/wiki/2002_World_Series#Composite_box,https://en.wikipedia.org/wiki/Barry_Bonds,https://en.wikipedia.org/wiki/Darin_Erstad,https://en.wikipedia.org/wiki/David_Bell_(baseball),https://en.wikipedia.org/wiki/Jeff_Kent,https://en.wikipedia.org/wiki/J._T._Snow,https://en.wikipedia.org/wiki/Reggie_Sanders,https://en.wikipedia.org/wiki/Rich_Aurilia,https://en.wikipedia.org/wiki/Scott_Spiezio,https://en.wikipedia.org/wiki/Shawon_Dunston,"https://en.wikipedia.org/wiki/Tim_Salmon, https://en.wikipedia.org/wiki/Troy_Glaus",Tabular reasoning,"['https://en.wikipedia.org/wiki/2002_World_Series#Composite_box', 'https://en.wikipedia.org/wiki/Barry_Bonds', 'https://en.wikipedia.org/wiki/Darin_Erstad', 'https://en.wikipedia.org/wiki/David_Bell_(baseball)', 'https://en.wikipedia.org/wiki/Jeff_Kent', 'https://en.wikipedia.org/wiki/J._T._Snow', 'https://en.wikipedia.org/wiki/Reggie_Sanders', 'https://en.wikipedia.org/wiki/Rich_Aurilia', 'https://en.wikipedia.org/wiki/Scott_Spiezio', 'https://en.wikipedia.org/wiki/Shawon_Dunston', 'https://en.wikipedia.org/wiki/Tim_Salmon, https://en.wikipedia.org/wiki/Troy_Glaus']"
231,"Out of all of the feature-length theatrical films that John Carpenter directed before 2015, which has the longest running time?",Starman (1984),https://en.wikipedia.org/wiki/John_Carpenter_filmography,https://en.wikipedia.org/wiki/Dark_Star_(film),https://en.wikipedia.org/wiki/Assault_on_Precinct_13_(1976_film),https://en.wikipedia.org/wiki/Halloween_(1978_film),https://en.wikipedia.org/wiki/The_Fog,https://en.wikipedia.org/wiki/Escape_from_New_York,https://en.wikipedia.org/wiki/The_Thing_(1982_film),https://en.wikipedia.org/wiki/Christine_(1983_film),https://en.wikipedia.org/wiki/Starman_(film),https://en.wikipedia.org/wiki/Big_Trouble_in_Little_China,"https://en.wikipedia.org/wiki/Prince_of_Darkness_(film), https://en.wikipedia.org/wiki/They_Live, https://en.wikipedia.org/wiki/Memoirs_of_an_Invisible_Man_(film), https://en.wikipedia.org/wiki/In_the_Mouth_of_Madness, https://en.wikipedia.org/wiki/Village_of_the_Damned_(1995_film), https://en.wikipedia.org/wiki/Escape_from_L.A., https://en.wikipedia.org/wiki/Vampires_(1998_film), https://en.wikipedia.org/wiki/Ghosts_of_Mars, https://en.wikipedia.org/wiki/The_Ward_(film)",Tabular reasoning,"['https://en.wikipedia.org/wiki/John_Carpenter_filmography', 'https://en.wikipedia.org/wiki/Dark_Star_(film)', 'https://en.wikipedia.org/wiki/Assault_on_Precinct_13_(1976_film)', 'https://en.wikipedia.org/wiki/Halloween_(1978_film)', 'https://en.wikipedia.org/wiki/The_Fog', 'https://en.wikipedia.org/wiki/Escape_from_New_York', 'https://en.wikipedia.org/wiki/The_Thing_(1982_film)', 'https://en.wikipedia.org/wiki/Christine_(1983_film)', 'https://en.wikipedia.org/wiki/Starman_(film)', 'https://en.wikipedia.org/wiki/Big_Trouble_in_Little_China', 'https://en.wikipedia.org/wiki/Prince_of_Darkness_(film), https://en.wikipedia.org/wiki/They_Live, https://en.wikipedia.org/wiki/Memoirs_of_an_Invisible_Man_(film), https://en.wikipedia.org/wiki/In_the_Mouth_of_Madness, https://en.wikipedia.org/wiki/Village_of_the_Damned_(1995_film), https://en.wikipedia.org/wiki/Escape_from_L.A., https://en.wikipedia.org/wiki/Vampires_(1998_film), https://en.wikipedia.org/wiki/Ghosts_of_Mars, https://en.wikipedia.org/wiki/The_Ward_(film)']"
232,How much taller (in centimetres) is Mark O'Halloran (ex West Tigers rugby league player) than the London Broncos' player with the heritage number 341?,11cm,https://en.wikipedia.org/wiki/Mark_O%27Halloran_(rugby_league),https://en.wikipedia.org/wiki/Robert_Fico,https://en.wikipedia.org/wiki/London_Broncos#1994%E2%80%932005:_Broncos_and_Super_League,https://en.wikipedia.org/wiki/Steele_Retchless,,,,,,,,Numerical reasoning | Multiple constraints | Post processing | Temporal reasoning,"['https://en.wikipedia.org/wiki/Mark_O%27Halloran_(rugby_league)', 'https://en.wikipedia.org/wiki/Robert_Fico', 'https://en.wikipedia.org/wiki/London_Broncos#1994%E2%80%932005:_Broncos_and_Super_League', 'https://en.wikipedia.org/wiki/Steele_Retchless']"
233,"This founder of the Academy of Science, St. Louis became established as a botonist for a monograph he did in 1842. What is the scientic name for plant featured in that monograph?",Cuscuta,"https://en.wikipedia.org/wiki/Academy_of_Science,_St._Louis",https://en.wikipedia.org/wiki/George_Engelmann,https://en.wikipedia.org/wiki/Cuscuta,,,,,,,,,Multiple constraints,"['https://en.wikipedia.org/wiki/Academy_of_Science,_St._Louis', 'https://en.wikipedia.org/wiki/George_Engelmann', 'https://en.wikipedia.org/wiki/Cuscuta']"
234,"Which American actress, born the same year Denzel Washington won his first Best Actor in a Leading Role Academy Award, had a supporting role in the second season of the Netflix series ""You""?",Jenna Ortega,https://en.wikipedia.org/wiki/List_of_awards_and_nominations_received_by_Denzel_Washington,https://en.wikipedia.org/wiki/Jenna_Ortega,https://en.wikipedia.org/wiki/Victoria_Pedretti,https://en.wikipedia.org/wiki/Carmela_Zumbado,https://en.wikipedia.org/wiki/Ambyr_Childers,https://en.wikipedia.org/wiki/Saffron_Burrows,https://en.wikipedia.org/wiki/Tati_Gabrielle,https://en.wikipedia.org/wiki/You_(TV_series)#Season_2_(2019),,,,Numerical reasoning | Multiple constraints | Post processing | Temporal reasoning,"['https://en.wikipedia.org/wiki/List_of_awards_and_nominations_received_by_Denzel_Washington', 'https://en.wikipedia.org/wiki/Jenna_Ortega', 'https://en.wikipedia.org/wiki/Victoria_Pedretti', 'https://en.wikipedia.org/wiki/Carmela_Zumbado', 'https://en.wikipedia.org/wiki/Ambyr_Childers', 'https://en.wikipedia.org/wiki/Saffron_Burrows', 'https://en.wikipedia.org/wiki/Tati_Gabrielle', 'https://en.wikipedia.org/wiki/You_(TV_series)#Season_2_(2019)']"
235,"What is the birthday of the man who produced the pop song named after one of the largest bird in the Procellariiformes species, off the 2024 album The Tortured Poets Department?","Aaron Dessner was born April 23, 1976.",https://en.wikipedia.org/wiki/Procellariiformes,https://en.wikipedia.org/wiki/Aaron_Dessner,https://en.wikipedia.org/wiki/The_Tortured_Poets_Department,,,,,,,,,Tabular reasoning | Multiple constraints | Post processing,"['https://en.wikipedia.org/wiki/Procellariiformes', 'https://en.wikipedia.org/wiki/Aaron_Dessner', 'https://en.wikipedia.org/wiki/The_Tortured_Poets_Department']"
236,What Jeep model shares its name with the Secret Service codename for a 21st-century US president?,Renegade,https://en.wikipedia.org/wiki/Secret_Service_code_name,https://en.wikipedia.org/wiki/List_of_Jeep_vehicles,,,,,,,,,,Multiple constraints,"['https://en.wikipedia.org/wiki/Secret_Service_code_name', 'https://en.wikipedia.org/wiki/List_of_Jeep_vehicles']"
237,Who was the Prime Minister of Canada in the year that the 1965 winner of the Best New Artist Grammy Award made their first appearance on US television?,Lester Pearson,https://en.wikipedia.org/wiki/Grammy_Award_for_Best_New_Artist#1960s,https://en.wikipedia.org/wiki/The_Beatles,https://en.wikipedia.org/wiki/List_of_prime_ministers_of_Canada#Prime_ministers,,,,,,,,,Multiple constraints,"['https://en.wikipedia.org/wiki/Grammy_Award_for_Best_New_Artist#1960s', 'https://en.wikipedia.org/wiki/The_Beatles', 'https://en.wikipedia.org/wiki/List_of_prime_ministers_of_Canada#Prime_ministers']"
238,"Part of the dynamic duo who broke a record set by Mickey Lolich and Bill Freehan in 1975 for most starts together, this MLB pitcher's battery mate ranked first all-time among catchers in putouts as of 2022. In what year did he (the pitcher)  make his Grand Ole Opry debut?",2024,https://en.wikipedia.org/wiki/St._Louis_Cardinals,https://en.wikipedia.org/wiki/Yadier_Molina,https://en.wikipedia.org/wiki/Adam_Wainwright,,,,,,,,,Multiple constraints | Temporal reasoning,"['https://en.wikipedia.org/wiki/St._Louis_Cardinals', 'https://en.wikipedia.org/wiki/Yadier_Molina', 'https://en.wikipedia.org/wiki/Adam_Wainwright']"
239,How much time passed between the release of the blockchain platform founded by the individual who resides in the town of the same name as the James Buchanan House and the release of the prior blockchain platform co-founded by the same individual?,"Wheatland, also known as the James Buchanan House, is the same name as the town in Wyoming where Charles Hoskinson resides.  Charles Hoskinson cofounded Ethereum and founded Cardano.  Cardano was released in 2017; Ethereum was released in 2015.  Two years elapsed between the two platforms' releases.",https://en.wikipedia.org/wiki/Wheatland_(James_Buchanan_House),"https://en.wikipedia.org/wiki/Wheatland,_Wyoming",https://en.wikipedia.org/wiki/Cardano_(blockchain_platform),https://en.wikipedia.org/wiki/Ethereum#Ether,,,,,,,,Numerical reasoning | Multiple constraints | Temporal reasoning,"['https://en.wikipedia.org/wiki/Wheatland_(James_Buchanan_House)', 'https://en.wikipedia.org/wiki/Wheatland,_Wyoming', 'https://en.wikipedia.org/wiki/Cardano_(blockchain_platform)', 'https://en.wikipedia.org/wiki/Ethereum#Ether']"
240,Who was the character in the roster of the Marvel vs. Capcom entry that was ported to the PlayStation 4 in 2016 that represented a video game franchise that has zombies as main antagonists and is the player character of a game released in 1999?,Jill Valentine,https://en.wikipedia.org/wiki/Marvel_vs._Capcom,https://en.wikipedia.org/wiki/Ultimate_Marvel_vs._Capcom_3,https://en.wikipedia.org/wiki/Jill_Valentine,https://en.wikipedia.org/wiki/Nemesis_(Resident_Evil),https://en.wikipedia.org/wiki/Albert_Wesker,https://en.wikipedia.org/wiki/Chris_Redfield,https://en.wikipedia.org/wiki/Frank_West_(Dead_Rising),https://en.wikipedia.org/wiki/Resident_Evil_3:_Nemesis,,,,Multiple constraints,"['https://en.wikipedia.org/wiki/Marvel_vs._Capcom', 'https://en.wikipedia.org/wiki/Ultimate_Marvel_vs._Capcom_3', 'https://en.wikipedia.org/wiki/Jill_Valentine', 'https://en.wikipedia.org/wiki/Nemesis_(Resident_Evil)', 'https://en.wikipedia.org/wiki/Albert_Wesker', 'https://en.wikipedia.org/wiki/Chris_Redfield', 'https://en.wikipedia.org/wiki/Frank_West_(Dead_Rising)', 'https://en.wikipedia.org/wiki/Resident_Evil_3:_Nemesis']"
241,"The screenwriter of the film, which received nominations for Best Screenplay and Best Actor in a Motion Picture - Drama at the 1995 Golden Globes, attended which Michigan university?",Grand Valley State University,https://en.wikipedia.org/wiki/Golden_Globe_Award_for_Best_Actor_in_a_Motion_Picture_%E2%80%93_Drama,https://en.wikipedia.org/wiki/Golden_Globe_Award_for_Best_Screenplay,https://en.wikipedia.org/wiki/Tim_Robbins,https://en.wikipedia.org/wiki/Patrick_Sheane_Duncan,,,,,,,,Tabular reasoning | Multiple constraints,"['https://en.wikipedia.org/wiki/Golden_Globe_Award_for_Best_Actor_in_a_Motion_Picture_%E2%80%93_Drama', 'https://en.wikipedia.org/wiki/Golden_Globe_Award_for_Best_Screenplay', 'https://en.wikipedia.org/wiki/Tim_Robbins', 'https://en.wikipedia.org/wiki/Patrick_Sheane_Duncan']"
242,NASA launched an Apollo mission a year after the Stonewall Riots. How many collective children did the astronauts onboard that mission have?,8,https://en.wikipedia.org/wiki/Stonewall_riots,https://en.wikipedia.org/wiki/List_of_Apollo_missions,https://en.wikipedia.org/wiki/Jim_Lovell,https://en.wikipedia.org/wiki/Jack_Swigert,https://en.wikipedia.org/wiki/Fred_Haise,,,,,,,Numerical reasoning | Tabular reasoning | Multiple constraints | Post processing | Temporal reasoning,"['https://en.wikipedia.org/wiki/Stonewall_riots', 'https://en.wikipedia.org/wiki/List_of_Apollo_missions', 'https://en.wikipedia.org/wiki/Jim_Lovell', 'https://en.wikipedia.org/wiki/Jack_Swigert', 'https://en.wikipedia.org/wiki/Fred_Haise']"
243,A United States women's national soccer team player scored her first career international goal during the semi-final match of the 2015 FIFA Women's World Cup. This same player scored her second goal the next year. Tell me the difference in attendance between these two games.,"43,518",https://en.wikipedia.org/wiki/2015_FIFA_Women%27s_World_Cup_knockout_stage,https://en.wikipedia.org/wiki/Kelley_O%27Hara,https://en.wikipedia.org/wiki/Carli_Lloyd,https://en.wikipedia.org/wiki/2016_CONCACAF_Women%27s_Olympic_Qualifying_Championship#Group_A,,,,,,,,Numerical reasoning | Tabular reasoning | Multiple constraints | Post processing | Temporal reasoning,"['https://en.wikipedia.org/wiki/2015_FIFA_Women%27s_World_Cup_knockout_stage', 'https://en.wikipedia.org/wiki/Kelley_O%27Hara', 'https://en.wikipedia.org/wiki/Carli_Lloyd', 'https://en.wikipedia.org/wiki/2016_CONCACAF_Women%27s_Olympic_Qualifying_Championship#Group_A']"
244,"Who is the Formula One driver who won their first Driver's Championship in the 46th season, what team did they race for that year, and how many years after that team's first race was it?","Nigel Mansell, Williams Grand Prix Engineering, 15 years",https://en.wikipedia.org/wiki/History_of_Formula_One,https://en.wikipedia.org/wiki/1992_Formula_One_World_Championship,https://en.m.wikipedia.org/wiki/Williams_Grand_Prix_Engineering,,,,,,,,,Numerical reasoning | Multiple constraints | Temporal reasoning,"['https://en.wikipedia.org/wiki/History_of_Formula_One', 'https://en.wikipedia.org/wiki/1992_Formula_One_World_Championship', 'https://en.m.wikipedia.org/wiki/Williams_Grand_Prix_Engineering']"
245,"There is only one existing lighthouse with attached living quarters in the ninth-largest US state by area, as of August 1, 2024. This lighthouse is located on the north side of a bay named for which tribe?",The Yaquina Tribe,https://en.wikipedia.org/wiki/Yaquina_Bay_Light,https://en.wikipedia.org/wiki/Oregon,https://en.wikipedia.org/wiki/Yaquina_Bay,,,,,,,,,Multiple constraints,"['https://en.wikipedia.org/wiki/Yaquina_Bay_Light', 'https://en.wikipedia.org/wiki/Oregon', 'https://en.wikipedia.org/wiki/Yaquina_Bay']"
